name,pos,club,proj_score,ps26,bye,age,games25,category,smoky_note,adp,player_id,notes,manual_insight,avg_2025_blend,draft_score,best_pos,vorp_proxy,market_rank,expert_consensus_rank,expert_rank_count,expert_best_rank,expert_worst_rank,expert_rank_stddev,expert_percentile,data_relative_value,data_vs_next_pick,data_waiver_strength,data_projected,data_risk,data_dpp,data_b23,data_gm25,data_notes,pdf_notes,pdf_role_change,pdf_midfield_uplift,pdf_season_out,pdf_source_count,rankings_vorp,rankings_projected,rankings_avg_2026,rankings_avg_2025,rankings_variance,rankings_l5,rankings_max,rankings_cba_pct,rankings_bye_round,rankings_injury,ultimate_price,ultimate_priced_at,ultimate_avg_2025,ultimate_games_2025,ultimate_max_2025,ultimate_x100_2025,ultimate_x120_2025,ultimate_tog_pct,ultimate_cba_pct,ultimate_avg_2024,ultimate_games_2024,ultimate_avg_2023,ultimate_games_2023,afl_2025_games_all,afl_2025_fp_all,afl_2025_reg_avg,afl_2025_l5_avg,afl_2025_finals_avg,afl_2025_max,afl_2025_100_plus,afl_2025_120_plus,afl_2025_cba_pct,afl_2025_ppm,afl_salary,afl_owned_pct,stats_2025_games_all,stats_2025_avg_all,stats_2025_max_all,stats_2025_100_plus_all,stats_2025_120_plus_all,stats_2025_stddev_all,stats_2025_reg_games,stats_2025_reg_avg,stats_2025_l5_avg,stats_2025_finals_games,stats_2025_finals_avg,projection_spread,projection_source_count,adp_value_gap,data_confidence,data_confidence_score,source_count,source_rankings_csv,source_ultimate_xlsx,source_expert_xlsx,source_data_csv,source_afl_fantasy_xlsx,source_afl_stats_csv,club_conflict,position_conflict,projection_conflict,bye_conflict,conflict_notes
Harry Sheezel,MID/FWD,NTH,115.3,127.0,0,21,23,premium,,2.0,1023518,"Role: Likely more mid time, 50% CBAS at least. Will score anywhere.",,109.2,164.62,FWD,45.3,0,,0,,,0.0,0.5,38.9,0.0,0.5,108.9,Low,Yes,✔,23,"Role: Likely more mid time, 50% CBAS at least. Will score anywhere.",,0,0,0,0,,115.3,,109.2,,127.0,186.0,,0,,,,109.2,23,186.0,17,4,86.0,0.38,112.1,21,97.3,23,,,,,,,,,,,,,,,,,,,,,,,,6.4,2,2.0,medium,0.76,3,1,1,0,1,0,0,0,0,0,1,"Bye mismatch: 0, 12"
Nasiah Wanganeen-Milera,DEF,STK,115.8,108.8,4,23,23,premium,,1.0,1015507,Role: Likely inserted into midfield. Will score well anywhere.,,110.8,146.67,DEF,34.7,0,,0,,,0.0,0.5,24.7,-0.2,0.8,103.8,Low,No,✔,23,Role: Likely inserted into midfield. Will score well anywhere.,,0,0,0,0,,115.78,,110.8,,108.8,151.0,,4,,,,110.8,23,151.0,17,7,83.0,0.27,97.7,22,91.3,23,,,,,,,,,,,,,,,,,,,,,,,,12.0,2,1.0,medium,0.68,3,1,1,0,1,0,0,0,0,1,1,"Bye mismatch: 4, 16"
Jordan Dawson,MID,ADE,114.1,114.4,0,28,23,premium,,12.5,992242,,,110.2,133.81,MID,22.9,0,,0,,,0.0,0.5,34.7,0.0,0.8,114.1,Low,No,✔,25,,,0,0,0,0,,97.61,,110.2,,114.4,147.0,,0,,,,110.2,23,147.0,15,9,84.0,0.74,105.3,22,113.4,23,,,,,,,,,,,,,,,,,,,,,,,,16.5,2,12.5,medium,0.65,3,1,1,0,1,0,0,0,0,1,1,"Bye mismatch: 0, 12"
Sam Flanders,FWD,STK,100.0,60.4,4,24,21,premium,,39.0,1009260,"Role: Inside mid, will score well above 2026 average.",,68.3,133.52,FWD,30.0,0,,0,,,0.0,0.5,30.0,-8.9,1.5,100.0,Low,No,✔,23,"Role: Inside mid, will score well above 2026 average.",,0,0,0,0,,62.52,,68.2,,60.4,107.0,,4,,,,68.3,21,107.0,1,0,78.0,0.09,107.8,22,89.6,14,,,,,,,,,,,,,,,,,,,,,,,,37.5,2,39.0,medium,0.68,3,1,1,0,1,0,0,0,0,1,1,"Bye mismatch: 4, 16"
Lachie Whitfield,DEF,GWS,106.7,110.0,4,31,22,premium,,8.0,294305,,,105.2,128.66,DEF,25.6,0,,0,,,0.0,0.5,24.9,0.0,0.8,104.0,Low,No,✔,23,,,0,0,0,0,,106.74,,105.2,,110.0,143.0,,4,,,,105.2,22,143.0,15,5,78.0,0.0,111.7,23,94.7,21,,,,,,,,,,,,,,,,,,,,,,,,2.7,2,8.0,medium,0.73,3,1,1,0,1,0,0,0,0,0,1,"Bye mismatch: 4, 13"
Errol Gulden,MID,SYD,111.6,105.2,3,23,10,premium,,14.0,1013128,"Role: outside/inside midfielder, always around the ball. Some injury impacted games in 2025, scoring should increase.",,102.3,128.0,MID,20.4,0,,0,,,0.0,0.5,32.2,-2.5,1.0,111.6,Medium,No,✔,10,"Role: outside/inside midfielder, always around the ball. Some injury impacted games in 2025, scoring should increase.",,0,0,0,0,,99.57,,102.3,,105.2,133.0,,3,,,,102.3,10,133.0,4,3,86.0,0.19,108.5,23,112.5,23,,,,,,,,,,,,,,,,,,,,,,,,12.0,2,14.0,medium,0.68,3,1,1,0,1,0,0,0,0,1,1,"Bye mismatch: 3, 15"
Max Gawn,RUC,MEL,110.5,120.8,0,34,23,premium,,5.0,290528,,,113.3,124.61,RUC,20.7,0,,0,,,0.0,0.5,25.1,0.0,0.0,110.5,Medium,No,✔,23,,,0,0,0,0,,108.65,,113.3,,120.8,158.0,,0,,,,113.3,23,158.0,17,10,86.0,0.85,111.8,21,92.1,20,,,,,,,,,,,,,,,,,,,,,,,,1.8,2,5.0,medium,0.73,3,1,1,0,1,0,0,0,0,0,1,"Bye mismatch: 0, 16"
Connor Rozee,DEF/MID,ADE,104.0,91.6,0,26,21,premium,,15.0,1001299,Role: scores better off half back. May play mid.,,104.1,123.11,DEF,22.9,0,,0,,,0.0,0.5,24.9,0.0,0.8,104.0,Low,Yes,✔,21,Role: scores better off half back. May play mid.,,0,0,0,0,,91.65,,104.2,,91.6,145.0,,0,,,,104.1,21,145.0,14,6,86.0,0.35,97.1,20,105.9,23,,,,,,,,,,,,,,,,,,,,,,,,12.3,2,15.0,low,0.6,3,1,1,0,1,0,0,1,0,1,1,"Club mismatch: ADE, PTA | Bye mismatch: 0, 12"
Tristan Xerri,RUC,NTH,110.3,111.2,0,26,20,premium,,6.0,1004965,"Poor health in 2025, likely to get a scoring bump in 2026. Ruck rules may impact him.",,105.0,123.03,RUC,20.5,0,,0,,,0.0,0.5,21.2,-3.9,0.0,106.6,Low,No,✔,20,"Poor health in 2025, likely to get a scoring bump in 2026. Ruck rules may impact him.",,0,0,0,0,,110.3,,105.0,,111.2,165.0,,0,,,,105.0,20,165.0,9,6,84.0,0.85,114.5,23,66.0,9,,,,,,,,,,,,,,,,,,,,,,,,3.7,2,6.0,medium,0.76,3,1,1,0,1,0,0,0,0,0,1,"Bye mismatch: 0, 12"
Bailey Smith,MID,GEE,109.2,116.2,2,25,20,premium,,4.0,1006130,"Interrupted pre-season: Calf strain, Likely play Rd0.",,116.3,121.71,MID,18.0,0,,0,,,0.0,0.5,29.8,-4.9,1.2,109.2,Medium,No,✔,23,"Interrupted pre-season: Calf strain, Likely play Rd0.",,0,0,0,0,,107.43,,116.3,,116.2,149.0,,2,,,,116.3,20,149.0,16,10,83.0,0.71,0.0,0,83.3,19,,,,,,,,,,,,,,,,,,,,,,,,1.8,2,4.0,medium,0.76,3,1,1,0,1,0,0,0,0,0,1,"Bye mismatch: 2, 16"
Tim English,RUC,WBD,108.3,118.4,3,28,23,premium,,9.0,1004592,,,110.7,119.61,RUC,18.5,0,,0,,,0.0,0.5,22.9,-2.2,0.0,108.3,Low,No,✔,23,,,0,0,0,0,,105.48,,110.8,,118.4,145.0,,3,,,,110.7,23,145.0,16,8,83.0,0.83,104.6,22,118.7,23,,,,,,,,,,,,,,,,,,,,,,,,2.8,2,9.0,medium,0.73,3,1,1,0,1,0,0,0,0,0,1,"Bye mismatch: 3, 16"
Nic Newman,DEF,CAR,101.4,0.0,2,33,0,smoky,Suspension/Interrupted pre-season: Rd 2 return.,32.0,297907,"Suspension/Interrupted pre-season: Rd 2 return. Hamstring issues. Coming off an injured 2024, likely to return to 90+. A hamstring niggle in pre-season. Was fit at end of 2025.",,0.0,118.82,DEF,20.3,0,,0,,,0.0,0.5,22.3,-2.6,1.1,101.4,High,No,✔,,"Suspension/Interrupted pre-season: Rd 2 return. Hamstring issues. Coming off an injured 2024, likely to return to 90+. A hamstring niggle in pre-season. Was fit at end of 2025.",,0,0,0,0,,100.04,,0.0,,0.0,0.0,,2,,,,0.0,0,,,,,,102.6,23,98.0,21,,,,,,,,,,,,,,,,,,,,,,,,1.4,2,32.0,medium,0.76,3,1,1,0,1,0,0,0,0,0,1,"Bye mismatch: 2, 14"
Marcus Bontempelli,MID,WBD,107.3,127.0,3,30,18,premium,,7.0,297373,,,111.3,117.24,MID,16.1,0,,0,,,0.0,0.5,27.9,-6.8,1.4,107.3,Medium,No,✔,18,,,0,0,0,0,,102.87,,111.3,,127.0,166.0,,3,,,,111.3,18,166.0,13,8,81.0,0.67,107.3,23,117.0,23,,,,,,,,,,,,,,,,,,,,,,,,4.4,2,7.0,medium,0.73,3,1,1,0,1,0,0,0,0,0,1,"Bye mismatch: 3, 16"
Nick Daicos,MID,COL,107.3,107.0,2,23,23,premium,,3.0,1023261,"Reports of possible leg niggle. Collingwood predicted to decline, may get fewer tags.",,108.1,116.16,MID,16.1,0,,0,,,0.0,0.5,25.4,-9.3,1.8,104.8,Low,No,✔,25,"Reports of possible leg niggle. Collingwood predicted to decline, may get fewer tags.",,0,0,0,0,,107.35,,108.1,,107.0,162.0,,2,,,,108.1,23,162.0,13,10,85.0,0.72,104.7,23,108.8,20,,,,,,,,,,,,,,,,,,,,,,,,2.5,2,3.0,medium,0.76,3,1,1,0,1,0,0,0,0,0,1,"Bye mismatch: 2, 14"
Josh Dunkley,MID,BRL,106.6,116.8,2,29,23,premium,,10.0,993834,Interrupted pre-season: Shoulder and ankle.,,107.5,115.9,MID,15.4,0,,0,,,0.0,0.5,27.2,-7.5,1.5,106.6,Low,No,✔,27,Interrupted pre-season: Shoulder and ankle.,,0,0,0,0,,106.26,,107.5,,116.8,137.0,,2,,,,107.5,23,137.0,14,6,83.0,0.76,107.4,23,104.4,21,,,,,,,,,,,,,,,,,,,,,,,,0.3,2,10.0,medium,0.76,3,1,1,0,1,0,0,0,0,0,1,"Bye mismatch: 2, 15"
Izak Rankine,MID/FWD,ADE,92.8,79.4,0,25,22,smoky,Suspension: Round 2 return.,46.0,1001195,"Suspension: Round 2 return. Role: Very likely to maintain mid time in 2026. Interrupted pre-season: Ankle injury, will miss practice games but shouldn't miss regular season games",,87.2,115.4,FWD,22.8,0,,0,,,0.0,0.5,20.8,-16.1,3.1,92.8,Low,Yes,✔,22,"Suspension: Round 2 return. Role: Very likely to maintain mid time in 2026. Interrupted pre-season: Ankle injury, will miss practice games but shouldn't miss regular season games",,0,0,0,0,,75.96,,87.2,,79.4,120.0,,0,,,,87.2,22,120.0,6,1,85.0,0.4,79.8,15,74.2,20,,,,,,,,,,,,,,,,,,,,,,,,16.8,2,46.0,medium,0.68,3,1,1,0,1,0,0,0,0,1,1,"Bye mismatch: 0, 12"
Dayne Zorko,DEF,BRL,99.7,86.8,2,37,23,premium,,26.0,261224,No word of any injuries. May be a safe pick for 2026 given age.,,101.5,114.22,DEF,18.6,0,,0,,,0.0,0.5,20.6,-4.3,1.3,99.7,Medium,No,✔,27,No word of any injuries. May be a safe pick for 2026 given age.,,0,0,0,0,,96.0,,101.5,,86.8,137.0,,2,,,,101.5,23,137.0,14,6,84.0,0.0,110.3,23,84.8,17,,,,,,,,,,,,,,,,,,,,,,,,3.7,2,26.0,medium,0.76,3,1,1,0,1,0,0,0,0,0,1,"Bye mismatch: 2, 15"
Sam Walsh,MID,CAR,105.2,87.2,2,25,14,premium,,37.0,1006094,"Scoring should increase if he remains healthy, could be 100+",,93.1,114.19,MID,14.0,0,,0,,,0.0,0.5,25.8,-8.9,1.7,105.2,Low,No,✔,14,"Scoring should increase if he remains healthy, could be 100+",,0,0,0,0,,95.87,,93.1,,87.2,137.0,,2,,,,93.1,14,137.0,3,2,79.0,0.56,106.1,19,94.6,15,,,,,,,,,,,,,,,,,,,,,,,,9.3,2,37.0,medium,0.68,3,1,1,0,1,0,0,0,0,1,1,"Bye mismatch: 2, 14"
Andrew Brayshaw,MID,FRE,104.1,82.8,0,26,23,premium,,25.0,1002232,"Scoring dip due to Dockers game style, added tackles to make up for drop in marks. Could have more meat on the bone if the dockers score more overall. Additions of Jackson and Young may impact.",,101.0,111.05,MID,12.9,0,,0,,,0.0,0.5,24.7,-10.0,1.9,104.1,Low,No,✔,24,"Scoring dip due to Dockers game style, added tackles to make up for drop in marks. Could have more meat on the bone if the dockers score more overall. Additions of Jackson and Young may impact.",,0,0,0,0,,98.87,,101.0,,82.8,138.0,,0,,,,101.0,23,138.0,11,4,82.0,0.77,104.6,23,110.3,23,,,,,,,,,,,,,,,,,,,,,,,,5.2,2,25.0,medium,0.76,3,1,1,0,1,0,0,0,0,0,1,"Bye mismatch: 0, 14"
Kysaiah Pickett,MID/FWD,MEL,90.5,79.2,0,24,20,smoky,Role: Likely to maintain midfield.,36.0,1008541,Role: Likely to maintain midfield. Poor floor.,,87.3,110.53,FWD,20.5,0,,0,,,0.0,0.5,20.5,-18.4,3.8,90.5,Medium,Yes,✔,20,Role: Likely to maintain midfield. Poor floor.,,0,0,0,0,,78.43,,87.3,,79.2,126.0,,0,,,,87.3,20,126.0,7,1,83.0,0.69,66.0,21,63.1,21,,,,,,,,,,,,,,,,,,,,,,,,12.1,2,36.0,medium,0.68,3,1,1,0,1,0,0,0,0,1,1,"Bye mismatch: 0, 16"
Colby McKercher,DEF,NTH,97.7,94.2,0,20,23,smoky,"Flag: Cracked finger, likely to play Rd1, unlikely to impact scoring.",40.0,1024272,"Flag: Cracked finger, likely to play Rd1, unlikely to impact scoring. Role: Gun scorer off half back, likely role for 2026.",,78.5,110.1,DEF,16.6,0,,0,,,0.0,0.5,18.6,-6.3,1.6,97.7,Low,No,✔,23,"Flag: Cracked finger, likely to play Rd1, unlikely to impact scoring. Role: Gun scorer off half back, likely role for 2026.",,0,0,0,0,,91.78,,78.5,,94.2,124.0,,0,,,,78.5,23,124.0,5,1,82.0,0.01,82.3,16,0.0,0,,,,,,,,,,,,,,,,,,,,,,,,5.9,2,40.0,medium,0.76,3,1,1,0,1,0,0,0,0,0,1,"Bye mismatch: 0, 12"
Joel Freijah,MID/FWD,WBD,89.8,64.6,3,20,23,smoky,Training as a midfielder in preseason and has DPP flexibility.,108.0,1027704,Role: Likely moving into mid field with Treloar age & injury. Training full time mid. | Manual insight: Training as a midfielder in preseason and has DPP flexibility.,Training as a midfielder in preseason and has DPP flexibility.,71.3,108.84,FWD,19.8,0,,0,,,0.0,0.5,19.8,-19.1,4.1,89.8,Low,Yes,✔,23,Role: Likely moving into mid field with Treloar age & injury. Training full time mid.,,0,0,0,0,,65.13,,71.3,,64.6,116.0,,3,,,,71.3,23,116.0,2,0,83.0,0.19,61.1,12,0.0,0,,,,,,,,,,,,,,,,,,,,,,,,24.7,2,108.0,medium,0.68,3,1,1,0,1,0,0,0,0,1,1,"Bye mismatch: 3, 16"
Gryan Miers,FWD,GEE,89.9,95.0,2,26,21,value,,45.0,1004938,"Injury: Thumb, return Rd 1 or 2. Role: Had a lot of mid time in back half of 2025. Scoring may drop a little if that doesn't continue.",,93.8,108.76,FWD,19.9,0,,0,,,0.0,0.5,19.0,-19.0,4.0,89.9,Low,No,✔,24,"Injury: Thumb, return Rd 1 or 2. Role: Had a lot of mid time in back half of 2025. Scoring may drop a little if that doesn't continue.",,0,0,0,0,,72.78,,93.8,,95.0,137.0,,2,,,,93.8,21,137.0,8,2,82.0,0.13,85.2,23,75.5,23,,,,,,,,,,,,,,,,,,,,,,,,17.1,2,45.0,medium,0.68,3,1,1,0,1,0,0,0,0,1,1,"Bye mismatch: 2, 16"
Jack Steele,MID,MEL,104.3,75.8,0,30,21,premium,,17.0,296205,Role: Likely number 1 mid.,,95.9,108.24,MID,13.1,0,,0,,,0.0,0.5,17.3,-17.4,3.5,96.7,Low,No,✔,22,Role: Likely number 1 mid.,,0,0,0,0,,104.26,,95.9,,75.8,136.0,,0,,,,95.9,21,136.0,13,3,76.0,0.74,106.6,23,97.9,20,,,,,,,,,,,,,,,,,,,,,,,,7.6,2,17.0,medium,0.76,3,1,1,0,1,0,0,0,0,0,1,"Bye mismatch: 0, 16"
Brodie Grundy,RUC,SYD,103.3,116.2,3,31,22,premium,,12.5,293957,,,107.0,107.79,RUC,13.5,0,,0,,,0.0,0.5,17.9,-7.2,0.1,103.3,Low,No,✔,22,,,0,0,0,0,,102.7,,107.0,,116.2,150.0,,3,,,,107.0,22,150.0,14,9,79.0,0.8,97.0,23,75.0,17,,,,,,,,,,,,,,,,,,,,,,,,0.6,2,12.5,medium,0.73,3,1,1,0,1,0,0,0,0,0,1,"Bye mismatch: 3, 15"
Nic Martin,MID/FWD,ESS,92.3,77.0,0,24,16,value,,53.0,1012013,Injury: Season.,,97.4,107.4,FWD,22.3,0,,0,,,0.0,0.5,,-20.4,4.6,88.5,High,Yes,✔,16,Injury: Season.,,0,0,0,0,,92.35,,97.4,,77.0,166.0,,0,,,,97.4,16,166.0,9,4,86.0,0.12,107.2,23,85.2,23,,,,,,,,,,,,,,,,,,,,,,,,3.8,2,53.0,medium,0.76,3,1,1,0,1,0,0,0,0,0,1,"Bye mismatch: 0, 15"
Dylan Moore,FWD,HAW,89.2,87.8,3,26,23,smoky,Role: Likely to get mid time bump.,66.0,1006314,Role: Likely to get mid time bump. High scoring high half forward. Scoring could get back to 2024 levels.,,81.8,107.38,FWD,19.2,0,,0,,,0.0,0.5,19.2,-19.7,4.3,89.2,Low,No,✔,26,Role: Likely to get mid time bump. High scoring high half forward. Scoring could get back to 2024 levels.,,0,0,0,0,,75.65,,81.8,,87.8,143.0,,3,,,,81.8,23,143.0,4,3,84.0,0.18,92.0,23,88.0,23,,,,,,,,,,,,,,,,,,,,,,,,13.5,2,66.0,medium,0.68,3,1,1,0,1,0,0,0,0,1,1,"Bye mismatch: 3, 14"
Zak Butters,MID,ADE,103.6,104.0,0,25,20,premium,,11.0,1006121,,,99.9,106.64,MID,12.4,0,,0,,,0.0,0.5,19.5,-15.2,3.0,98.9,Low,No,✔,20,,,0,0,0,0,,103.57,,99.9,,104.0,152.0,,0,,,,99.9,20,152.0,11,4,82.0,0.77,106.1,23,99.5,23,,,,,,,,,,,,,,,,,,,,,,,,4.7,2,11.0,medium,0.65,3,1,1,0,1,0,0,1,0,0,1,"Club mismatch: ADE, PTA | Bye mismatch: 0, 12"
Christian Petracca,MID/FWD,GCS,89.3,84.4,3,30,23,premium,,20.0,298210,Role: Mid/fwd rotations likely. Hard to break into team as full mid. Scoring shouldnt decline.,,90.4,106.43,FWD,19.3,0,,0,,,0.0,0.5,19.3,-19.6,4.3,89.3,Low,Yes,✔,23,Role: Mid/fwd rotations likely. Hard to break into team as full mid. Scoring shouldnt decline.,,0,0,0,0,,80.91,,90.3,,84.4,121.0,,3,,,,90.4,23,121.0,8,1,85.0,0.66,90.0,13,106.0,23,,,,,,,,,,,,,,,,,,,,,,,,8.4,2,20.0,medium,0.68,3,1,1,0,1,0,0,0,0,1,1,"Bye mismatch: 3, 12"
Hugh McCluggage,MID,BRL,101.8,108.6,2,27,23,premium,,28.0,1000978,,,102.2,105.61,MID,10.6,0,,0,,,0.0,0.5,22.4,-12.3,2.3,101.8,Low,No,✔,27,,,0,0,0,0,,96.3,,102.2,,108.6,152.0,,2,,,,102.2,23,152.0,12,4,82.0,0.73,97.3,23,89.3,22,,,,,,,,,,,,,,,,,,,,,,,,5.5,2,28.0,medium,0.73,3,1,1,0,1,0,0,0,0,0,1,"Bye mismatch: 2, 15"
Darcy Cameron,RUC,COL,101.7,96.4,2,30,23,premium,,30.0,990291,,,102.0,105.31,RUC,11.9,0,,0,,,0.0,0.5,16.3,-8.8,0.1,101.7,Low,No,✔,25,,,0,0,0,0,,95.09,,102.0,,96.4,140.0,,2,,,,102.0,23,140.0,13,5,80.0,0.78,96.2,23,84.0,16,,,,,,,,,,,,,,,,,,,,,,,,6.6,2,30.0,medium,0.73,3,1,1,0,1,0,0,0,0,0,1,"Bye mismatch: 2, 14"
Zach Merrett,MID,ESS,102.0,107.4,0,30,22,premium,,16.0,992016,,,102.8,105.09,MID,10.8,0,,0,,,0.0,0.5,22.5,-12.2,2.3,101.9,Low,No,✔,22,,,0,0,0,0,,101.96,,103.4,,107.4,149.0,,0,,,,102.8,22,149.0,11,5,87.0,0.63,108.7,23,112.9,22,,,,,,,,,,,,,,,,,,,,,,,,0.1,2,16.0,medium,0.73,3,1,1,0,1,0,0,0,0,0,1,"Bye mismatch: 0, 15"
Luke Jackson,RUC,FRE,101.5,88.8,0,24,20,smoky,Role: May play as a mid.,38.0,1009399,Role: May play as a mid. Either way will be around the ball if Darcy is injured.,,94.9,105.03,RUC,11.7,0,,0,,,0.0,0.5,16.1,-9.0,0.1,101.5,Medium,No,✔,21,Role: May play as a mid. Either way will be around the ball if Darcy is injured.,,0,0,0,0,,77.48,,94.9,,88.8,144.0,,0,,,,94.9,20,144.0,8,1,82.0,0.68,78.7,23,84.7,23,,,,,,,,,,,,,,,,,,,,,,,,24.0,2,38.0,medium,0.68,3,1,1,0,1,0,0,0,0,1,1,"Bye mismatch: 0, 14"
Rowan Marshall,RUC,STK,104.2,120.0,4,30,23,premium,,19.0,992468,"Flag: Ruck share with De Koning so will play partly Key Fwd, punt to get DPP.",,105.8,104.72,RUC,14.4,0,,0,,,0.0,0.5,2.9,-22.2,0.2,88.3,Low,No,✔,23,"Flag: Ruck share with De Koning so will play partly Key Fwd, punt to get DPP.",,0,0,0,0,,104.22,,105.8,,120.0,158.0,,4,,,,105.8,23,158.0,14,8,86.0,0.82,117.1,23,115.8,23,,,,,,,,,,,,,,,,,,,,,,,,15.9,2,19.0,medium,0.68,3,1,1,0,1,0,0,0,0,1,1,"Bye mismatch: 4, 16"
Jack Graham,MID/FWD,WCE,87.7,83.6,0,28,18,value,,83.0,990827,Interrupted pre-season: Hamstring strain.,,82.7,103.75,FWD,17.7,0,,0,,,0.0,0.5,17.7,-21.2,4.9,87.7,High,Yes,✔,18,Interrupted pre-season: Hamstring strain.,,0,0,0,0,,79.17,,82.7,,83.6,104.0,,0,,,,82.7,18,104.0,1,0,81.0,0.4,64.5,14,61.0,20,,,,,,,,,,,,,,,,,,,,,,,,8.5,2,83.0,medium,0.68,3,1,1,0,1,0,0,0,0,1,1,"Bye mismatch: 0, 15"
Isaac Heeney,MID,SYD,100.7,96.6,3,29,23,premium,,43.0,298539,"Role: Scoring was down in early 2025, but back up to 100+ in back half. Big 2026 likely.",,96.9,103.3,MID,9.5,0,,0,,,0.0,0.5,21.3,-13.4,2.6,100.7,Low,No,✔,23,"Role: Scoring was down in early 2025, but back up to 100+ in back half. Big 2026 likely.",,0,0,0,0,,85.3,,96.9,,96.6,166.0,,3,,,,96.9,23,166.0,11,2,84.0,0.75,105.2,21,80.0,22,,,,,,,,,,,,,,,,,,,,,,,,15.4,2,43.0,medium,0.68,3,1,1,0,1,0,0,0,0,1,1,"Bye mismatch: 3, 15"
Miles Bergman,DEF,ADE,95.1,78.8,0,24,19,smoky,Expected midfield-minute bump; watch role split in-season.,97.0,1009191,Interrupted-preseason: Foot niggle available rd1. Role: Likely full mid time. | Manual insight: Expected midfield-minute bump; watch role split in-season.,Expected midfield-minute bump; watch role split in-season.,78.3,103.17,DEF,14.0,0,,0,,,0.0,0.5,16.0,-8.9,2.1,95.1,Medium,No,✔,19,Interrupted-preseason: Foot niggle available rd1. Role: Likely full mid time.,,0,0,0,0,,72.43,,78.2,,78.8,120.0,,0,,,,78.3,19,120.0,6,1,85.0,0.28,75.1,23,60.0,22,,,,,,,,,,,,,,,,,,,,,,,,22.7,2,97.0,low,0.6,3,1,1,0,1,0,0,1,0,1,1,"Club mismatch: ADE, PTA | Bye mismatch: 0, 12"
Matt Rowell,MID,GCS,101.3,100.6,3,24,23,premium,,27.0,1009208,"Injury: Finger, Return ?Rd 2. Role unlikely to change",,101.2,101.71,MID,10.1,0,,0,,,0.0,0.5,14.1,-19.3,4.0,94.8,Low,No,✔,25,"Injury: Finger, Return ?Rd 2. Role unlikely to change",,0,0,0,0,,101.27,,100.4,,100.6,145.0,,3,,,,101.2,23,145.0,14,5,83.0,0.81,93.7,23,92.0,23,,,,,,,,,,,,,,,,,,,,,,,,6.5,2,27.0,medium,0.76,3,1,1,0,1,0,0,0,0,0,1,"Bye mismatch: 3, 12"
Noah Anderson,MID,GCS,100.0,92.2,3,25,23,premium,,31.0,1009199,Role unlikely to change.,,99.5,101.61,MID,8.8,0,,0,,,0.0,0.5,20.6,-14.1,2.7,100.0,Low,No,✔,25,Role unlikely to change.,,0,0,0,0,,95.17,,98.8,,92.2,133.0,,3,,,,99.5,23,133.0,13,3,86.0,0.85,104.0,23,100.5,23,,,,,,,,,,,,,,,,,,,,,,,,4.8,2,31.0,medium,0.76,3,1,1,0,1,0,0,0,0,0,1,"Bye mismatch: 3, 12"
Rory Laird,DEF,ADE,94.3,97.6,0,32,20,smoky,Role: May get more kick ins with Keane injury.,65.0,293222,Role: May get more kick ins with Keane injury.,,92.6,101.56,DEF,13.2,0,,0,,,0.0,0.5,15.2,-9.7,2.3,94.3,Low,No,✔,22,Role: May get more kick ins with Keane injury.,,0,0,0,0,,83.78,,92.6,,97.6,110.0,,0,,,,92.6,20,110.0,6,0,82.0,0.0,99.3,23,109.2,22,,,,,,,,,,,,,,,,,,,,,,,,10.5,2,65.0,medium,0.68,3,1,1,0,1,0,0,0,0,1,1,"Bye mismatch: 0, 12"
Jack Sinclair,DEF,STK,94.5,105.8,4,31,23,value,,22.0,994389,"Role: Half back, possibly less competition with Nas as he moves into midfield.",,100.7,101.32,DEF,13.4,0,,0,,,0.0,0.5,15.4,-9.5,2.2,94.5,Low,No,✔,23,"Role: Half back, possibly less competition with Nas as he moves into midfield.",,0,0,0,0,,93.7,,100.8,,105.8,146.0,,4,,,,100.7,23,146.0,11,4,85.0,0.08,101.9,22,102.2,23,,,,,,,,,,,,,,,,,,,,,,,,0.8,2,22.0,medium,0.76,3,1,1,0,1,0,0,0,0,0,1,"Bye mismatch: 4, 16"
Josh Daicos,DEF,COL,93.9,87.0,2,27,23,smoky,Role: Midfield time.,34.0,1005054,Role: Midfield time. Likely won't impact scoring.,,94.2,100.83,DEF,12.8,0,,0,,,0.0,0.5,14.8,-10.1,2.4,93.9,Low,No,✔,25,Role: Midfield time. Likely won't impact scoring.,,0,0,0,0,,87.48,,94.2,,87.0,132.0,,2,,,,94.2,23,132.0,9,2,86.0,0.06,94.8,23,94.7,23,,,,,,,,,,,,,,,,,,,,,,,,6.4,2,34.0,medium,0.76,3,1,1,0,1,0,0,0,0,0,1,"Bye mismatch: 2, 14"
Lachie Ash,DEF,GWS,96.2,84.8,4,24,23,value,,18.0,1009253,Role: Ash's disposal was poor in 2025. They may try to bypass him.,,100.1,100.38,DEF,15.1,0,,0,,,0.0,0.5,4.5,-20.4,6.1,83.6,Low,No,✔,24,Role: Ash's disposal was poor in 2025. They may try to bypass him.,,0,0,0,0,,96.22,,100.1,,84.8,135.0,,4,,,,100.1,23,135.0,16,2,83.0,0.01,77.4,17,84.3,23,,,,,,,,,,,,,,,,,,,,,,,,12.6,2,18.0,medium,0.68,3,1,1,0,1,0,0,0,0,1,1,"Bye mismatch: 4, 13"
Will Ashcroft,MID,BRL,99.8,100.8,2,21,23,premium,,24.0,1023517,Role: PS game indicated he may be the #1 CBA mid. Likely bump him up your order.,,95.5,100.08,MID,8.6,0,,0,,,0.0,0.5,19.0,-15.7,3.1,98.4,Low,No,✔,27,Role: PS game indicated he may be the #1 CBA mid. Likely bump him up your order.,,0,0,0,0,,99.83,,95.3,,100.8,119.0,,2,,,,95.5,23,119.0,14,0,82.0,0.51,84.7,9,82.9,18,,,,,,,,,,,,,,,,,,,,,,,,1.4,2,24.0,medium,0.76,3,1,1,0,1,0,0,0,0,0,1,"Bye mismatch: 2, 15"
Toby Nankervis,RUC,RIC,99.3,84.6,0,31,22,value,,73.0,298174,Flag: New ruck rules and age may impact scoring in 2026.,,91.1,100.03,RUC,9.5,0,,0,,,0.0,0.5,13.9,-11.2,0.1,99.3,Low,No,✔,22,Flag: New ruck rules and age may impact scoring in 2026.,,0,0,0,0,,91.7,,91.1,,84.6,150.0,,0,,,,91.1,22,150.0,5,2,82.0,0.83,100.6,21,102.3,15,,,,,,,,,,,,,,,,,,,,,,,,7.6,2,73.0,medium,0.76,3,1,1,0,1,0,0,0,0,0,1,"Bye mismatch: 0, 13"
Christian Salem,DEF,MEL,93.5,99.6,0,30,23,value,,54.0,296359,Interrupted pre-season: Hamstring niggle but available Rd1. Should score well with Bowey Injury and May on the out.,,93.0,99.94,DEF,12.4,0,,0,,,0.0,0.5,14.4,-10.5,2.5,93.5,High,No,✔,23,Interrupted pre-season: Hamstring niggle but available Rd1. Should score well with Bowey Injury and May on the out.,,0,0,0,0,,87.96,,93.0,,99.6,139.0,,0,,,,93.0,23,139.0,8,3,85.0,0.02,80.3,17,77.5,14,,,,,,,,,,,,,,,,,,,,,,,,5.5,2,54.0,medium,0.76,3,1,1,0,1,0,0,0,0,0,1,"Bye mismatch: 0, 16"
Adam Treloar,MID/FWD,WBD,86.7,69.8,3,32,4,smoky,Interrupted pre-season: Hamstring and Calf tightness.,51.0,291790,Interrupted pre-season: Hamstring and Calf tightness. Role: Likely less mid time as he ages and doesnt get a full pre-season.,,69.8,99.83,FWD,16.7,0,,0,,,0.0,0.5,11.5,-27.4,8.2,81.5,High,Yes,✔,4,Interrupted pre-season: Hamstring and Calf tightness. Role: Likely less mid time as he ages and doesnt get a full pre-season.,,0,0,0,0,,86.74,,69.8,,69.8,94.0,,3,,,,69.8,4,94.0,0,0,60.0,0.24,110.0,22,105.3,19,,,,,,,,,,,,,,,,,,,,,,,,5.2,2,51.0,medium,0.76,3,1,1,0,1,0,0,0,0,0,1,"Bye mismatch: 3, 16"
Finn Callaghan,MID,GWS,100.2,104.0,4,22,20,premium,,21.0,1023266,Interrupted pre-season: Minor hip complaint. May miss a couple of weeks training before the season.,,99.0,99.26,MID,9.0,0,,0,,,0.0,0.5,15.0,-19.7,4.2,94.4,Low,No,✔,21,Interrupted pre-season: Minor hip complaint. May miss a couple of weeks training before the season.,,0,0,0,0,,100.17,,99.0,,104.0,124.0,,4,,,,99.0,20,124.0,10,4,81.0,0.76,76.9,22,75.8,18,,,,,,,,,,,,,,,,,,,,,,,,5.8,2,21.0,medium,0.76,3,1,1,0,1,0,0,0,0,0,1,"Bye mismatch: 4, 13"
Jaspa Fletcher,DEF,BRL,93.1,91.2,2,22,23,smoky,Role: May player higher on a wing if Coleman comes into the side.,88.0,1023708,Role: May player higher on a wing if Coleman comes into the side. May reduce scoring.,,83.0,98.65,DEF,12.0,0,,0,,,0.0,0.5,14.0,-10.9,2.6,93.1,Low,No,✔,27,Role: May player higher on a wing if Coleman comes into the side. May reduce scoring.,,0,0,0,0,,77.74,,83.0,,91.2,141.0,,2,,,,83.0,23,141.0,5,1,82.0,0.0,60.4,23,50.3,11,,,,,,,,,,,,,,,,,,,,,,,,15.4,2,88.0,medium,0.68,3,1,1,0,1,0,0,0,0,1,1,"Bye mismatch: 2, 15"
Mason Redman,DEF,ESS,94.4,104.4,0,28,19,value,,55.0,997078,,,85.8,97.9,DEF,13.3,0,,0,,,0.0,0.5,4.5,-20.4,6.1,83.6,Low,No,✔,19,,,0,0,0,0,,94.39,,86.1,,104.4,143.0,,0,,,,85.8,19,143.0,3,1,85.0,0.02,83.9,21,86.0,23,,,,,,,,,,,,,,,,,,,,,,,,10.8,2,55.0,medium,0.65,3,1,1,0,1,0,0,0,0,1,1,"Bye mismatch: 0, 15"
Jarrod Witts,RUC,GCS,99.2,95.6,3,33,22,smoky,Role: Scoring may be impacted by ruck rules.,44.0,291975,Role: Scoring may be impacted by ruck rules. Hand cuff to Moyle,,92.4,97.26,RUC,9.4,0,,0,,,0.0,0.5,6.6,-18.5,0.2,92.0,Low,No,✔,24,Role: Scoring may be impacted by ruck rules. Hand cuff to Moyle,,0,0,0,0,,99.17,,92.9,,95.6,138.0,,3,,,,92.4,22,138.0,6,2,85.0,0.85,96.3,16,90.8,21,,,,,,,,,,,,,,,,,,,,,,,,7.2,2,44.0,medium,0.76,3,1,1,0,1,0,0,0,0,0,1,"Bye mismatch: 3, 12"
Max Holmes,MID,GEE,99.8,100.8,2,23,23,premium,,23.0,1015889,Role: May get pushed to a wing/half back with Worple and others entering the midfield.,,100.9,96.88,MID,8.6,0,,0,,,0.0,0.5,11.0,-23.7,5.5,90.4,Low,No,✔,26,Role: May get pushed to a wing/half back with Worple and others entering the midfield.,,0,0,0,0,,99.78,,100.9,,100.8,146.0,,2,,,,100.9,23,146.0,12,6,80.0,0.67,94.5,23,75.9,21,,,,,,,,,,,,,,,,,,,,,,,,9.4,2,23.0,medium,0.68,3,1,1,0,1,0,0,0,0,1,1,"Bye mismatch: 2, 16"
Caleb Serong,MID,FRE,97.8,78.6,0,25,23,value,,33.0,1009420,Scoring impacted by team scoring/style. If you see Dockers retaining the ball more his scoring will improve,,92.4,96.45,MID,6.6,0,,0,,,0.0,0.5,18.4,-16.3,3.2,97.8,Low,No,✔,24,Scoring impacted by team scoring/style. If you see Dockers retaining the ball more his scoring will improve,,0,0,0,0,,96.57,,92.4,,78.6,146.0,,0,,,,92.4,23,146.0,9,4,83.0,0.82,104.0,23,108.1,22,,,,,,,,,,,,,,,,,,,,,,,,1.2,2,33.0,medium,0.76,3,1,1,0,1,0,0,0,0,0,1,"Bye mismatch: 0, 14"
